{
  "version": 2,
  "type": "source-program-scene",
  "commandId": "scn_aaaaaaaaaaaaaaaa",
  "assignmentId": "asn_aaaaaaaaaaaaaaaa",
  "programId": "prg_aaaaaaaaaaaaaaaa",
  "programEpoch": 1,
  "leaseId": "lea_aaaaaaaaaaaaaaaa",
  "fencingRevision": 1,
  "expectedSceneRevision": 1,
  "layout": "grid",
  "sourceLeaseIds": [
    "sls_aaaaaaaaaaaaaaaa"
  ],
  "activeSourceLeaseId": "",
  "issuedAt": 1788958800000,
  "expiresAt": 1788958804000,
  "sourceFits": [
    "contain"
  ]
}
